Project_ID,Project_Name,Country,Approval_Date,Status,Total_Commitment_USD,Sector_Codes
P513580,South Africa's Infrastructure Modernization and Job Creation DPL,South Africa,2026-06-18,Pipeline,1500000000,"LLP,LLT,TTF,TTW,WWA,WWC"
P507504,Philippines Sustainable Agriculture Transformation Program,Philippines,2026-03-27,Active,1000000000,"AAB,AAF,AAH,AAI,AAK,AAL,AAT,SSA,WWC,YYA"
P505813,South Africa Metro Trading Services Program,South Africa,2025-11-07,Active,925000000,"BBH,LLZ,WWA,WWB,WWC"
P181389,Philippines First  Energy Transition and Climate Resilience DPL,Philippines,2025-03-31,Active,800000000,"LLP,LLT,LLW,LLZ,WWA,WWC"
P501037,Second Inclusive and Resilient Market Economy Development Policy Operation,Uzbekistan,2024-10-03,Active,800000000,"AAZ,BBC,BBZ,LLG,LLP,NNC,TTW,WWW,YYZ"
P163732,Sustainable Rural Water Supply and Sanitation Program,Tanzania,2018-06-26,Closed,650000000,"WA,WC,WF"
P510631,Chao Phraya Flood Management Plan 2,Thailand,2027-02-17,Pipeline,610000000,"AAI,BBH,NNI,SSA,WWF,WWW"
P511300,Uganda Cities and Municipalities Infrastructure Development (UCMID),Uganda,2026-03-31,Active,540000000,"BBH,NNC,TTF,WWA,WWB,WWC"
P513708,Ghana Market Access and Connectivity Project,Ghana,2026-05-28,Pipeline,500000000,"AAK,NNI,TTF,TTI,WWC,YYA"
P181263,Green and Resilient Development for a Decarbonized Economy in Peru,Peru,2025-03-26,Active,500000000,"AAT,BBZ,LLP,TTZ,WWA,WWC"
P512898,Water Secure Haryana Program,India,2026-07-30,Pipeline,500000000,"AAB,AAH,AAI,AAK,WWA,WWW"
P510383,Bioeconomy and Sustainable Regional Development project,Brazil,2027-03-30,Pipeline,500000000,"AAI,AAK,AAT,NNI,WWW,YYA"
P509251,Kambarata-1 HPP: Sustainable and Transformational Energy Project,Central Asia,2026-10-09,Pipeline,500000000,"BBC,LLH,LLP,LLT,NNF,SSA,WWW"
P179684,Sustainable Power and Irrigation for Nigeria Project,Nigeria,2024-09-26,Active,500000000,"AAI,LLH,LLZ,WWF,WWW"
P508541,PRIME Regional Development PforR,Turkiye,2026-01-15,Dropped,450000000,"AAI,AAK,BBH,LLP,NNF,WWW,YYA,YYF,YYT"
P506272,Karnataka Water Security and Resilience Program,India,2025-06-23,Active,426000000,"BBH,WWA,WWC,WWF,WWW"
P170734,"Nigeria Sustainable Urban and Rural Water Supply, Sanitation and Hygiene Program-for-Results",Nigeria,2021-05-25,Active,410000000,"WA,WC,WF"
P513389,Jammu and Kashmir Sustainable Local Economic and Tourism Development Project,India,2026-04-03,Pipeline,402000000,"BBH,NNI,WWA,WWC,YYF,YYT"
P510901,Cote d'Ivoire Private Investment and Productive Jobs DPF1,Cote d'Ivoire,2026-06-05,Pipeline,400000000,"AAB,AAK,LLP,LLT,LLU,WWC"
P508094,Punjab Inclusive Cities Program,Pakistan,2025-12-11,Active,400000000,"BBH,WWA,WWB,WWC"
P179770,Southern Niger Connectivity and Integration Project,Niger,2025-05-19,Active,400000000,"TTF,TTI,WWA,YYY"
P508202,"Amazon and Cerrado Bioeconomy, Forest Restoration, and Climate-Smart Agriculture Project",Brazil,2026-09-24,Pipeline,400000000,"AAB,AAK,AAT,FFA,FFK,LLU,LLZ,NNF,SSA,WWW"
P178389,Water Supply and Sanitation Access Program (PASEA) Project,"Congo, Democratic Republic of",2023-06-09,Active,400000000,"WA,WC,WF,WZ"
P509756,BR State of Piauí Strengthening Fiscal Sustainability and Fostering Sustainable Economic Development,Brazil,2025-12-16,Active,376623392,"AAZ,BBC,BBH,WWA,WWW"
P506770,Metro Dhaka Water Security and Resilience Program,Bangladesh,2026-02-10,Active,370000000,"AAI,WWA,WWB,WWF,WWZ"
P179039,Karnataka Sustainable Rural Water Supply Program,India,2023-03-28,Active,363000000,"WC,WF,WZ"
P515014,Clean Metro Manila,Philippines,2026-11-27,Pipeline,350000000,"NNF,NNI,WWA,WWB,WWC,WWF"
P181029,Sustainable Financing for Rogun Hydropower Project,Tajikistan,2024-12-17,Active,350000000,"LLH,LLP,WWW,WWZ"
P179192,Morocco Water Security and Resilience Program,Morocco,2023-07-18,Active,350000000,"AZ,WA,WC,WF,WZ"
P508930,Blended Finance Platform for Resilient Infrastructure,South Africa,2026-02-24,Active,338820000,"BBC,DDI,FFK,LLP,LLT,SSA,TTC,TTF,WWC,WWF,YYY"
P508034,"Sindh Transformational Accelerated Rural Water Supply, Sanitation and Hygiene Services Project",Pakistan,2026-05-28,Dropped,300000000,"WWA,WWC"
P512645,Learning Enhancement and Acceleration in Primary Education in Bangladesh,Bangladesh,2026-08-13,Pipeline,300000000,"EEC,EEF,EEP,NNI,SSG,WWA"
P510120,Ruzizi 3 Regional Hydropower Project,East Africa II,2026-09-24,Pipeline,300000000,"LLH,LLP,LLT,NNI,WWW"
P507912,United Republic of Tanzania - Development Policy Financing with Catastrophe Deferred Drawdown Option,Tanzania,2025-06-05,Active,300000000,"BBC,BBH,BBZ,FFA,HHG,LLT,WWW,YYY"
P164345,Burkina Faso Water Supply and Sanitation Program,Burkina Faso,2018-06-26,Active,300000000,"WA,WC,WF,WZ"
P508320,Central African Power Pool Regional Interconnection and Access (CAPP-RIA) - Phase 1,Western and Central Africa,2026-12-07,Pipeline,280500000,"BBH,LLH,LLP,LLT,NNI,WWW"
P176429,Chattogram Water Supply Improvement Project,Bangladesh,2024-12-19,Active,280000000,"WWA,WWC,WWF"
P506340,Maharashtra Resilience Development Project,India,2026-05-28,Pipeline,280000000,"AAK,BBH,NNF,SSA,SSG,TTC,WWF,WWW"
P163782,Integrated Water Management and Development Project,Uganda,2018-06-14,Active,280000000,"WA,WC,WF"
P507658,Hai Phong City Resilience Development Project,Viet Nam,2026-11-23,Pipeline,260100000,"BBH,NNI,TTC,TTF,WWF,WWW"
P504170,Second Greater Beirut Water Supply Project,Lebanon,2025-01-14,Active,257800000,"WWC,WWF"
P510359,Philippines Accelerated Water and Sanitation Project in Selected Areas (AWSPSA),Philippines,2026-07-31,Pipeline,250886416,"NNI,WWA,WWC,WWF,WWW"
P512715,"Resilience, Early Action, and Disaster Readiness for Khyber Pakhtunkhwa",Pakistan,2026-06-26,Pipeline,250000000,"AAT,BBH,NNC,NNF,WWF,WWW"
P506807,Green Urban Development Project,China,2025-06-27,Active,250000000,"BBH,TTC,WWW"
P513815,Resilient Action for Development and Disaster Recovery Himachal Pradesh,India,2026-02-10,Active,245000000,"LLT,NNC,NNF,TTI,WWF,WWW"
P171422,Second Karachi Water and Sewerage Services Improvement Project (KWSSIP-2),Pakistan,2024-12-12,Active,240000000,"WWA,WWC,WWF"
P512663,Hainan Integrated Coastal Ecosystems Management PforR,China,2026-06-18,Pipeline,230000000,"AAF,AAK,AAT,AAZ,NNC,WWW"
P511426,Morocco Ifahsa Pumped Hydropower Storage (PHS) Project,Morocco,2026-06-09,Pipeline,220000000,"LLH,LLP,LLT,LLU,LLW,WWW"
P164186,Benin Rural Water Supply Universal Access Program,Benin,2018-05-15,Active,220000000,WC
P509293,Green and Future Cities Project,Turkiye,2026-06-05,Pipeline,219400000,"BBH,TTC,TTF,WWA,WWC,WWF"
P514340,Potable Water Security and Resilience Project,Tunisia,2026-03-31,Active,208500000,"BBC,BBH,WWA,WWC,WWF,WWW"
P508450,"Plan PAZcifico Continuity: Water, Sanitation and Waterway Connectivity Project",Colombia,2027-05-14,Pipeline,205600000,"NNI,TTF,TTP,WWA,WWC,WWF"
P507944,Integrated Urban Development and Resilience Project for Jobs,Madagascar,2026-07-01,Pipeline,204000000,"AAK,BBH,NNC,WWA,WWB,WWF,WWW"
P513301,DRC: Scaling-Up Water Supply and Sanitation Access in Kinshasa Project,"Congo, Democratic Republic of",2026-11-06,Pipeline,200000000,"BBH,SSA,WWA,WWB,WWC,WWF"
P508698,Sustainable Rural Water Supply and Sanitation Program Phase II,Tanzania,2025-09-30,Active,200000000,"EEP,HHQ,WWA,WWC,WWF"
P505093,Peru: Wastewater Management and Circular Economy,Peru,2025-09-29,Active,200000000,"WWA,WWC,WWF"
P180321,Cameroon Water Security Project,Cameroon,2025-05-07,Active,200000000,"WWA,WWC,WWF,WWW"
P179017,Guinea Water and Sanitation Project,Guinea,2025-04-04,Active,200000000,"NNF,WWA,WWC,WWF"
P510697,Second Community Action for Landscape Management Program for Results,Ethiopia,2026-04-30,Active,200000000,"AAB,AAH,AAI,AAK,AAL,AAT,NNC,NNI,WWW"
P508364,Ethiopia: Climate Resilient Irrigation for Sustainable Production (CRISP),Ethiopia,2026-03-31,Active,200000000,"AAB,AAI,AAK,NNI,WWW"
P507147,Morocco Disaster and Climate Resilience Program,Morocco,2025-12-01,Dropped,200000000,"BBH,EEF,LLP,NNC,NNF,SSG,TTC,TTF,WWB,WWF,WWW"
P509738,Kenya Watershed Services Improvement Project,Kenya,2025-06-12,Active,200000000,"AAT,WWF,WWW"
P180017,"Cameroon Second Fiscal Sustainability, Inclusive and Sustainable Growth Development Policy Financing",Cameroon,2025-03-14,Active,200000000,"BBC,BBH,DDS,EEF,SSA,WWW"
P169342,"BD Rural Water, Sanitation and Hygiene for Human Capital Development  Project",Bangladesh,2020-09-25,Active,200000000,"WA,WC,WF"
P151224,Second Water Sector Institutional Development Project,Angola,2017-03-10,Active,200000000,"WA,WC,WF"
P176619,Jordan Water Sector Efficiency Project,Jordan,2023-06-15,Active,200000000,"AI,WC,WF"
P510227,Parana Water Security Project,Brazil,2026-08-20,Pipeline,186000000,"AAB,AAI,BBH,WWA,WWC,WWF,WWW"
P515255,Mekong Delta Climate Resilience and Integrated Transformation Project,Viet Nam,2026-11-16,Pipeline,174540000,"AAB,AAI,AAK,AAT,BBC,WWW"
P512407,Sustainable Fisheries Development Project,Viet Nam,2026-07-07,Pipeline,155520000,"AAB,AAF,AAK,NNI,WWW"
P509225,ALAFIA I - Nourishing Benin's Future Program,Benin,2026-06-16,Pipeline,150000000,"EEC,HHF,HHG,SSA,WWA,WWC"
P179643,Access to Basic Services and Performance Improvement Project (PASBAP),Gabon,2026-02-05,Active,150000000,"LLT,LLU,WWA,WWC,WWF"
P505562,Yemen Improved Water Management and Irrigation for Sustainability and Efficiency Project,"Yemen, Republic of",2026-06-04,Pipeline,150000000,"AAI,AAK,SSA,WWA,WWF,WWW"
P513341,Regional Emergency Preparedness and Access to Inclusive Recovery Phase 3,"Congo, Democratic Republic of",2026-07-16,Pipeline,150000000,"AAK,BBH,FFP,NNF,SSA,WWW"
P507256,Burkina Faso Agricultural Transformation Project,Burkina Faso,2026-03-10,Active,150000000,"AAB,AAH,AAI,AAK,NNC,NNF,NNI,WWW,YYA"
P181344,Nepal Disaster Resilience Development Policy Credit with Cat DDO (NDRC),Nepal,2024-10-08,Active,150000000,"AAI,BBC,BBZ,HHG,WWW"
P178954,Water and Sanitation Project - I,Malawi,2023-03-23,Active,145000000,"WA,WC,WF"
P509890,Urban Water Security Project,Mozambique,2025-06-17,Active,143000000,"WWA,WWC,WWF,WWW"
P181633,Third Additional Financing Yemen Emergency Human Capital Project,"Yemen, Republic of",2024-12-06,Active,142000000,"HHF,HHG,HHQ,WWA,WWC"
P181603,Rwanda Disaster Risk Management Development Policy Credit with a Catastrophe Deferred Drawdown Option,Rwanda,2025-09-26,Active,141000000,"AAT,BBH,BBZ,HHF,LLP,TTF,WWA"
P507433,Modernization of Rani Jamara Kulariya Irrigation Project - Phase 3,Nepal,2025-05-29,Active,137000000,"AAI,AAK,WWW"
P507957,Chad Water Security and Resilience Project - PASER,Chad,2026-06-22,Pipeline,126500000,"AAL,AAT,BBH,LLU,SSA,WWA,WWF,WWW"
P511719,"Irrigation Water Security, Resilience and Value-Addition Project",Tunisia,2026-03-31,Active,124000000,"NNF,SSA,WWA,WWC,WWF,WWW"
P500620,Kyrgyz Republic: Water Supply and Sanitation Universal Access Program-1 Project,Kyrgyz Republic,2025-04-18,Active,121000000,"WWA,WWC,WWF"
P508221,Santa Catarina Flood Infrastructure and Resilience Improvement Project,Brazil,2026-06-22,Pipeline,119200000,"BBH,LLH,NNF,SSA,WWF,WWW"
P177146,Urban Resilience Emergency Project,Burundi,2024-07-01,Active,113000000,"WWC,WWF,WWW"
P181501,BR Enhancing Prosperity and Sustainability in the State of Sergipe Development Policy Financing,Brazil,2024-08-27,Active,110000000,"BBH,LLT,LLU,WWA,WWB,WWC,WWW"
P508608,First Sustainable and Inclusive Growth Development Policy Operation,Kyrgyz Republic,2025-06-20,Active,101500000,"BBC,EEF,HHG,LLP,NNI,WWW,YYZ"
P510696,Resilient Infrastructure for Regional Economic Development and Job Creation - Salta Project,Argentina,2026-07-06,Pipeline,100000000,"BBH,LLM,TTF,TTI,WWC,WWF"
P514199,"Jobs, Social Cohesion and Community Resilience in Northern Mozambique - Phase I",Mozambique,2026-05-21,Pipeline,100000000,"BBH,NNC,NNF,NNI,SSG,WWC"
P181538,Mali Water Security Project,Mali,2025-01-22,Active,100000000,"WWC,WWF,WWW"
P507116,First Zambia Climate and Economic Resilience Programmatic DPF with Cat-DDO,Zambia,2024-12-18,Active,100000000,"BBC,BBZ,LLT,SSA,WWC,WWW"
P178687,"NEPAL SECOND GREEN, RESILIENT, AND INCLUSIVE PROGRAMMATIC DEVELOPMENT POLICY CREDIT",Nepal,2024-12-12,Closed,100000000,"AAI,AAT,BBH,BBZ,WWA,WWC,WWW"
P180429,Bahia Sustainable Rural Development Project,Brazil,2024-11-07,Active,100000000,"AAB,AAK,WWC,YYA"
P507888,Community and Local Development in Western Côte d'Ivoire Project,Cote d'Ivoire,2026-05-19,Pipeline,100000000,"AAB,AAK,BBH,EEW,NNC,NNF,NNI,SSG,WWA"
P511605,"Sri Lanka Regional Empowerment through Vibrant, Inclusive, and Viable Economies",Sri Lanka,2026-03-31,Active,100000000,"AAF,AAK,BBH,TTI,WWA,YYT"
P511417,IDA-IFC Agribusiness Program Phase 1,"Yemen, Republic of",2026-09-30,Pipeline,100000000,"AAK,AAL,NNC,NNI,WWW,YYA"
P510691,Brazil: Arc of Restoration Project,Brazil,2026-09-30,Pipeline,100000000,"AAK,AAT,NNC,WWW,YYA"
P508689,Accelerating Innovation and Catalyzing Capacity for Resilience in Africa,Western and Central Africa,2026-03-31,Dropped,100000000,"AAB,AAH,AAK,AAL,EEW,NNI,SSA,WWW"
P514502,Yemen Health Nutrition and WASH Project,"Yemen, Republic of",2026-06-04,Pipeline,94000000,"HHF,HHG,SSA,WWA,WWC,WWF"
P179227,Balochistan Water Security and Productivity Improvement Project,Pakistan,2025-06-24,Active,94000000,"WWA,WWC,WWF,WWW"
P514272,Sudan Transition to Agriculture Recovery and Resilience Project,Sudan,2026-09-02,Pipeline,90000000,"AAB,AAH,AAI,AAK,AAL,SSA,WWW"
P509357,SAHEL RESILAND CHAD: Building Resilience through Sustainable Natural Resource Management,Chad,2026-02-26,Dropped,84409864,"AAK,AAL,AAT,NNC,NNF,NNI,SSA,WWW,YYA"
P507207,Burundi Water Supply and Sanitation Access Project,Burundi,2025-12-10,Active,80000000,"AAI,WWA,WWC,WWF"
P508124,Armenia Water and Irrigation Services Enhancement Program - Phase 1 Project,Armenia,2025-06-13,Active,80000000,"AAI,WWA,WWC,WWF,WWW"
P511489,STRENGTHENING OF THE PRIORITY TOURISM DESTINATION AREQUIPA-COLCA IN PERU,Peru,2026-07-09,Pipeline,77210000,"BBH,NNF,TTI,WWA,WWC,YYT"
P510776,Integrated Water Management and Development Project,Uganda,2025-12-18,Active,65000000,"WWA,WWC,WWF"
P505271,Poultry and Aquaculture Development Project,"Congo, Republic of",2026-06-25,Pipeline,60000000,"AAB,AAF,AAK,AAL,NNI,WWC,YYA"
P510690,Lao PDR Southeast Asia Disaster Risk Management Project II,Lao People's Democratic Republic,2026-05-22,Pipeline,60000000,"AAT,BBH,FFD,NNF,SSA,WWF,WWW"
P511840,Transforming Panama Cadaster Program for Results,Panama,2026-04-28,Active,60000000,"AAK,BBH,DDG,FFP,NNF,NNI,WWW"
P509009,Support for resilient livelihoods in the South of Madagascar,Madagascar,2025-06-18,Active,54000000,"AAB,AAI,BBH,NNC,WWW,YYA"
P511557,Paraiba Water Security Project (Northeast MPA Phase I),Brazil,2026-09-28,Pipeline,50000000,"BBH,WWA,WWC,WWF,WWW"
P508674,Barbados Water Security and Sector Performance Program,Barbados,2026-05-18,Pipeline,50000000,"BBH,WWA,WWB,WWC,WWF,WWW"
P510667,Pakistan Finance for Lowering Emissions in the Water and Waste Sectors,Pakistan,2026-10-30,Pipeline,40000000,"LLP,LLT,WWA,WWB,WWC,WWF"
P507588,Sierra Leone Water Security and WASH Access Improvement Project,Sierra Leone,2025-09-25,Active,40000000,"WWA,WWC,WWF,WWW"
P513248,Vanuatu: Pacific Islands Regional Oceanscape Program - First Phase,Vanuatu,2026-06-05,Pipeline,40000000,"AAB,AAF,AAK,LLU,NNI,WWW"
P511492,DJIBOUTI GROUNDWATER FOR RESILIENCE AND WATER SUPPLY PROJECT,Djibouti,2026-03-16,Active,36500000,"AAL,BBZ,NNC,WWF,WWW"
P512709,Montenegro Water Security and Climate Adaptation Phase 1 Project,Montenegro,2026-10-30,Pipeline,35000000,"NNF,WWA,WWC,WWF,WWW"
P513113,The Gambia Water and Sanitation Project,"Gambia, The",2026-07-15,Pipeline,30000000,"BBH,NNI,WWA,WWC,WWF,WWW"
P181702,Second Additional Financing to GAMA Sanitation and Water Project,Ghana,2024-08-08,Active,30000000,"WWA,WWC,WWF"
P507749,"Pacific Region Preparedness, Adaptation and Resilience - Samoa Project",Samoa,2026-03-19,Active,30000000,"BBC,BBH,EEF,HHF,HHG,NNF,NNI,SSA,SSG,TTC,TTF,WWA,WWB,WWF,WWW"
P504998,Saint Lucia Urban Resilient Flood Investment Project,St. Lucia,2025-09-29,Active,25000000,"BBH,WWW"
P181064,Belize Blue Cities and Beyond Project,Belize,2025-01-31,Active,23500000,"BBZ,WWA,WWB,WWC"
P180533,Mexico BioCarbon Emission Reduction Project,Mexico,2026-05-15,Pipeline,22000000,"AAB,AAK,AAT,NNF,NNI,WWW"
P507115,Barwaaqo - Somalia Water for Rural Resilience Project,"Somalia, Federal Republic of",2025-03-03,Active,18300000,"WWC,WWF"
P512157,Lesotho Lowlands Water Development Project - Phase II,Lesotho,2025-09-29,Active,17800000,WWC
P508792,Azerigas Gas Leak Detection and Repair Facility,Azerbaijan,2026-05-21,Pipeline,15000000,"LLG,LLP,LLT,LLW,SSA,WWW"
P508033,Second Tanzania Water Sector Support Project,Tanzania,2025-10-06,Active,13900000,"WWA,WWC,WWF,WWW"
P507148,Lesotho Lowlands Water Development Project - Phase II,Lesotho,2025-03-27,Closed,12200000,"AAI,WWC,WWF"
P506439,"Accelerating Access to Water, Sanitation and Hygiene in the Eastern and Southern Africa Region",Eastern and Southern Africa,2025-09-30,Active,10000000,"WWA,WWC,WWF"
P179067,SINT MAARTEN: WASTEWATER MANAGEMENT PROJECT,St Maarten,2024-08-08,Active,10000000,"WWA,WWF"
P513349,Cubango-Okavango River Basin (CORB): Financing Innovation in Transboundary Waters,Southern Africa,2026-05-07,Pipeline,10000000,"AAB,BBZ,NNI,WWF,WWW"
P512975,Regional Acceleration Project 1 under the Africa Resilient Irrigation for Sustainable Economies Multi-Phase Approach (RISE-RAP),Eastern and Southern Africa,2026-03-31,Active,10000000,"AAB,AAI,AAK,NNI,WWW,YYA"
P506802,Second Rwanda Urban Development Project,Rwanda,2025-12-11,Closed,10000000,"BBH,WWW"
P511194,Kingdom of Eswatini: Water Supply and Sanitation Access Project,Eswatini,2025-06-12,Active,8000000,WWC
P505546,Restoring Ecosystems for Marine Pollution Prevention (RE-MAP),Moldova,2025-10-10,Active,7903975,"AAK,AAL,AAT,WWW"
P179781,Additional Financing Grant Kosovo FOSTERING AND LEVERAGING OPPORTUNITIES FOR WATER SECURITY PROGRAM (PROJECT 1),Kosovo,2024-10-28,Active,5325000,WWW
P509144,Comoros National Water Resilience Project,Comoros,2025-04-29,Active,5000000,"WWC,WWF,WWW"
P509563,Kyrgyz Republic: Rural Sanitation and Fecal Sludge Management Project,Kyrgyz Republic,2026-06-23,Pipeline,4730000,"SSA,WWA,WWB,WWC,WWF,WWW"
P508001,Strengthening Climate and Water Information Management Systems,"Yemen, Republic of",2025-11-20,Dropped,4550000,"AAI,NNC,WWA,WWF,WWW"
P509605,Community Action for Resilient Education,Mali,2026-06-30,Pipeline,4100000,"EEF,EEP,NNI,SSA,WWA,WWC"
P512214,"Kazakhstan and Uzbekistan One Health for Pandemic Prevention, Food Systems Resilience, and Ecosystem Health",Central Asia,2026-05-31,Pipeline,3580000,"AAK,AAL,HHF,HHG,NNC,WWW"
P505581,Nile Civil Society for Climate Resilience Project,Eastern and Southern Africa,2025-03-28,Active,3000000,"WWF,WWW"
P506027,Incentivizing Nutrition-Sensitive and Climate-Smart Investments among Poor Households,Angola,2026-05-29,Pipeline,2750000,"AAB,HHG,SSA,SSG,WWW"
P181046,Optimization of Dam Safety and Resilience of Irrigation Systems in the Context of Climate Change,Albania,2025-05-30,Pipeline,1612903,"AAB,AAI,AAK,AAZ,LLH,WWF,WWW"
